<?xml version="1.0" encoding="UTF-8" standalone="yes"?>
<!--W3C Schema generated by XMLSpy v2006 rel. 3 U (http://www.altova.com)-->
<xs:schema xmlns:xs="http://www.w3.org/2001/XMLSchema" elementFormDefault="qualified">
	<xs:element name="allowJS">
		<xs:simpleType>
			<xs:restriction base="xs:boolean"/>
		</xs:simpleType>
	</xs:element>
	<xs:element name="autoRefreshed">
		<xs:simpleType>
			<xs:restriction base="xs:boolean"/>
		</xs:simpleType>
	</xs:element>
	<xs:element name="configMode">
		<xs:simpleType>
			<xs:restriction base="xs:boolean"/>
		</xs:simpleType>
	</xs:element>
	<xs:element name="editMode">
		<xs:simpleType>
			<xs:restriction base="xs:boolean"/>
		</xs:simpleType>
	</xs:element>
	<xs:element name="helpMode">
		<xs:simpleType>
			<xs:restriction base="xs:boolean"/>
		</xs:simpleType>
	</xs:element>
	<xs:element name="minimized">
		<xs:simpleType>
			<xs:restriction base="xs:boolean"/>
		</xs:simpleType>
	</xs:element>
	<xs:element name="maximized">
		<xs:simpleType>
			<xs:restriction base="xs:boolean"/>
		</xs:simpleType>
	</xs:element>	
	<xs:element name="windowSkin">
		<xs:simpleType>
			<xs:restriction base="xs:string"/>
		</xs:simpleType>
	</xs:element>
	<xs:element name="icon">
		<xs:simpleType>
			<xs:restriction base="xs:string"/>
		</xs:simpleType>
	</xs:element>
	<xs:element name="name">
		<xs:simpleType>
			<xs:restriction base="xs:string"/>
		</xs:simpleType>
	</xs:element>
	<xs:element name="pageRefreshed">
		<xs:simpleType>
			<xs:restriction base="xs:boolean"/>
		</xs:simpleType>
	</xs:element>
	<xs:element name="parameter">
		<xs:complexType>
			<xs:sequence>
				<xs:element ref="name"/>
				<xs:element ref="value"/>
			</xs:sequence>
		</xs:complexType>
	</xs:element>
	<xs:element name="path">
		<xs:simpleType>
			<xs:restriction base="xs:string"/>
		</xs:simpleType>
	</xs:element>
	<xs:element name="periodTime">
		<xs:simpleType>
			<xs:restriction base="xs:integer"/>
		</xs:simpleType>
	</xs:element>
	<xs:element name="subTag">
		<xs:simpleType>
			<xs:restriction base="xs:string"/>
		</xs:simpleType>
	</xs:element>
	<xs:element name="tag">
		<xs:simpleType>
			<xs:restriction base="xs:string"/>
		</xs:simpleType>
	</xs:element>
	<xs:element name="language">
		<xs:simpleType>
			<xs:restriction base="xs:string"/>
		</xs:simpleType>
	</xs:element>
	<xs:element name="portlet">
		<xs:complexType>
			<xs:sequence>
				<xs:element ref="name"/>
				<xs:element ref="path"/>
				<xs:element ref="title"/>
				<xs:element ref="icon"/>
				<xs:element ref="url"/>
				<xs:element ref="subTag" minOccurs="0"/>
				<xs:element ref="tag"/>
				<xs:element ref="language"/>
				<xs:element ref="refreshMode"/>
				<xs:element ref="editMode"/>
				<xs:element ref="helpMode"/>
				<xs:element ref="configMode"/>
				<xs:element ref="minimized" minOccurs="0"/>
				<xs:element ref="maximized" minOccurs="0"/>
				<xs:element ref="windowSkin" minOccurs="0"/>
				<xs:element ref="autoRefreshed"/>
				<xs:element ref="periodTime"/>
				<xs:element ref="allowJS"/>
				<xs:element ref="pageRefreshed"/>
				<xs:element ref="showNumber" minOccurs="0"/>
				<xs:element ref="showType" minOccurs="0"/>
				<xs:element ref="windowStatus" minOccurs="0"/>
				<xs:element ref="mode" minOccurs="0"/>
				<xs:element ref="type" minOccurs="0"/>
				<xs:element ref="parameter" minOccurs="0" maxOccurs="unbounded"/>
				<xs:element ref="roles" minOccurs="0"/>
			</xs:sequence>
		</xs:complexType>
	</xs:element>
	<xs:element name="roles">
		<xs:complexType>
			<xs:sequence>
				<xs:element ref="role" maxOccurs="unbounded"/>
			</xs:sequence>
		</xs:complexType>
	</xs:element>
	<xs:element name="role">
		<xs:simpleType>
			<xs:restriction base="xs:string"/>
		</xs:simpleType>
	</xs:element>
	<xs:element name="portlets">
		<xs:complexType>
			<xs:sequence>
				<xs:element ref="portlet" maxOccurs="unbounded"/>
			</xs:sequence>
		</xs:complexType>
	</xs:element>
	<xs:element name="refreshMode">
		<xs:simpleType>
			<xs:restriction base="xs:boolean"/>
		</xs:simpleType>
	</xs:element>
	<xs:element name="showNumber">
		<xs:simpleType>
			<xs:restriction base="xs:integer"/>
		</xs:simpleType>
	</xs:element>
	<xs:element name="showType">
		<xs:simpleType>
			<xs:restriction base="xs:integer"/>
		</xs:simpleType>
	</xs:element>
	<xs:element name="windowStatus">
		<xs:simpleType>
			<xs:restriction base="xs:integer"/>
		</xs:simpleType>
	</xs:element>
	<xs:element name="mode">
		<xs:simpleType>
			<xs:restriction base="xs:integer"/>
		</xs:simpleType>
	</xs:element>
	<xs:element name="type">
		<xs:simpleType>
			<xs:restriction base="xs:integer"/>
		</xs:simpleType>
	</xs:element>
	<xs:element name="title">
		<xs:simpleType>
			<xs:restriction base="xs:string"/>
		</xs:simpleType>
	</xs:element>
	<xs:element name="url" type="xs:string"/>
	<xs:element name="value" type="xs:string"/>
</xs:schema>
